job_id,job_title,company,salary_min,salary_max,yrs_of_exp_min,yrs_of_exp_max,job_city,due_date,jd,job_url,salary_text,company_name,company_link,updated_at,time_left,tags,location
1927496,Devops Engineer,N/A,30.0,45.0,3.0,3.0,Hà Nội,,"Build, and maintain CI/CD pipelines, integrating security scanning and compliance checks. Solid knowledge of any CI/CD tools (Gitlab, Jenkins, Github Action, …)Manage and optimize cloud infrastructure using AWS, Azure, or GCP.Has experience in cloud security best practices, IAM governance, and infrastructurehardening.Develop and maintain Infrastructure as Code (using Terraform, Pulumi, or CloudFormation)Implement deployment to any of Container Orchestration, strong knowledge ContainerOrchestration.Implement observability and monitoring (Prometheus, Grafana, ELK, OpenTelemetry)for better reliability.Automate security policies and integrate DevSecOps tools like SAST, DAST, andcompliance scanning into pipelines.",https://www.topcv.vn/viec-lam/devops-engineer/1927496.html?ta_source=ITJobs_LinkDetail,30 - 45 triệu,CÔNG TY CỔ PHẦN CÔNG NGHỆ ALPHAWAY,https://www.topcv.vn/cong-ty/cong-ty-co-phan-cong-nghe-alphaway/201267.html,Cập nhật 1 tuần trước,Còn17ngày để ứng tuyển,"Cloud Computing (aws, Azure, Gcp), Containerization (docker, Kubernetes), Ci Cd (jenkins, Gitlab Ci, Circleci), 1+",Hà Nội
1927500,Flutter Developer (Vin),N/A,30.0,45.0,4.0,4.0,Hồ Chí Minh,,"Tham gia phát triển Super App với hàng triệu người dùng, tích hợp nhiều mini app và dịch vụ nội bộ.Thiết kế, xây dựng kiến trúc module hóa, SDK nội bộ và framework dùng chung.Định hướng kỹ thuật cho team mobile (iOS & Android), đảm bảo chất lượng, hiệu năng, bảo mật và khả năng mở rộng.Phối hợp chặt chẽ với Product Owner, Backend, DevOps và UI/UX để triển khai tính năng mới.Tối ưu hiệu năng: startup time, memory, rendering, network.Tham gia review code, mentoring cho developer junior/mid.Đảm bảo sản phẩm tuân thủ guideline App Store / Google Play, chính sách bảo mật và compliance.",https://www.topcv.vn/viec-lam/flutter-developer-vin/1927500.html?ta_source=ITJobs_LinkDetail,30 - 45 triệu,CÔNG TY CỔ PHẦN CÔNG NGHỆ ALPHAWAY,https://www.topcv.vn/cong-ty/cong-ty-co-phan-cong-nghe-alphaway/201267.html,Cập nhật 1 tuần trước,Còn17ngày để ứng tuyển,"Flutter, Dart, RESTful APIs, 2+",Hồ Chí Minh
1823528,DevOps Engineer,Công ty Cổ phần TOPCV Việt Nam,,,2.0,2.0,Hà Nội,,"Vận hành hệ thống Linux server, giám sát và tối ưu hiệu năng hệ thống.Thiết lập và duy trì các pipeline CI/CD, versioning, GitOps.Quản lý dịch vụ Kubernetes Cluster (self-hosted), volume, ingress, helm.Tự động hóa quy trình với Ansible, Terraform, GitLab CI, ArgoCD.Quản trị hệ thống lưu trữ (NFS, Ceph, S3), giám sát hệ thống với Prometheus/Grafana.Quản lý người dùng, phân quyền, bảo mật hệ thống.Đảm bảo an toàn dữ liệu, thực hiện backup/restore.Làm việc với team dev để xây dựng môi trường staging, testing, production.Hỗ trợ vận hành các hệ thống CI/CD, giám sát và ứng cứu sự cố 24/7 (khi cần)",https://www.topcv.vn/brand/topcv/tuyen-dung/devops-engineer-j1823528.html?ta_source=ITJobs_LinkDetail,Thoả thuận,Công ty Cổ phần TOPCV Việt Nam,https://www.topcv.vn/brand/topcv?id=105,Cập nhật 1 tuần trước,Còn15ngày để ứng tuyển,"Linux, System Admin, CI/CD, 4+",Hà Nội
1927442,Java Developer (Golang),N/A,30.0,45.0,4.0,4.0,Hà Nội,,"Thiết kế, xây dựng và tối ưu các hệ thống backend theo kiến trúc microservices phục vụ hàng trăm nghìn người dùng trên nền tảng Web/MobilePhát triển, quản lý và mở rộng các API dịch vụ, đảm bảo hiệu suất cao, bảo mật và khả năng chịu tải lớnThiết kế luồng xử lý dữ liệu qua các message brokers (Kafka, NATS, RabbitMQ) và event-driven architecture.Tích hợp với hệ thống nội bộ và bên thứ ba, bao gồm authentication (OAuth2/OIDC/IDP), payment, hoặc các hệ thống quản trị khác.Triển khai, giám sát và tối ưu vận hành trên môi trường containerization & orchestration (Docker, Kubernetes) và cloud (AWS/Azure/GCP).Phối hợp chặt chẽ với các bộ phận Frontend, Mobile, QA, DevOps, BA/PM để xây dựng và triển khai tính năng.Theo dõi, đo lường hiệu năng, xác định điểm nghẽn và liên tục cải thiện chất lượng hệ thống.",https://www.topcv.vn/viec-lam/java-developer-golang/1927442.html?ta_source=ITJobs_LinkDetail,30 - 45 triệu,CÔNG TY CỔ PHẦN CÔNG NGHỆ ALPHAWAY,https://www.topcv.vn/cong-ty/cong-ty-co-phan-cong-nghe-alphaway/201267.html,Cập nhật 1 tuần trước,Còn17ngày để ứng tuyển,"Java, Go (golang), Lập Trình Hướng Đối Tượng (oop), 2+",Hà Nội
1757724,Senior Java,N/A,,29.0,5.0,5.0,Hồ Chí Minh,,"I. Mô tả công việc· Thiết kế và triển khai RESTful API, gRPC và các hệ thống microservices sử dụng Kotlin, Quarkus, RabbitMQ, Protobuf· Viết mã sạch, dễ bảo trì và có thể kiểm thử, tuân thủ theo các best practices· Duy trì và cải thiện quy trình CI/CD và workflow phát triển phần mềm· Tối ưu hóa hiệu suất và khả năng mở rộng của ứng dụng· Dẫn dắt một nhóm nhỏ, hỗ trợ Tech Lead trong việc quản lý, review code và đảm bảo tiến độ dự án",https://www.topcv.vn/viec-lam/senior-java/1757724.html?ta_source=ITJobs_LinkDetail,Tới 29 triệu,Công ty cổ phần Aequitas,https://www.topcv.vn/cong-ty/cong-ty-co-phan-aequitas/216860.html,Cập nhật 1 tuần trước,Còn17ngày để ứng tuyển,"Kotlin, RESTful APIs, Version Control (git), 2+",Hồ Chí Minh
1927430,Kỹ Thuật Viên Công Nghệ Thông Tin,N/A,,,2.0,2.0,Hồ Chí Minh,,"1. Xử lý & bảo trì thiết bị tin họcKiểm tra, sửa chữa, cài đặt hệ điều hành và phần mềm cho máy tính, laptop.Cài đặt driver, phần mềm hỗ trợ, và kết nối thiết bị ngoại vi (máy in, camera, máy scan…).Nạp mực, bảo trì, sửa chữa máy in, máy photocopy.Hỗ trợ khách hàng xử lý các sự cố phần cứng, phần mềm, mạng nội bộ nhanh chóng và chính xác. 2. Triển khai & vận hành hệ thống mạngLắp đặt, cấu hình, vận hành và bảo trì hệ thống mạng doanh nghiệp: Firewall, Router, Switch, Access Point, Peplink, Wireless Controller...Triển khai hệ thống mạng LAN, WAN, tổng đài điện thoại, UPS...Bấm dây mạng, đi dây hệ thống, lắp đặt thiết bị mạng tại văn phòng và công trình.Nghiên cứu, cập nhật công nghệ mới phục vụ các dự án triển khai. 3. Tham gia dự án công nghệ thông tinKhảo sát, thiết kế, thi công, tích hợp hệ thống mạng cho doanh nghiệp và viễn thông.Cấu hình, đo kiểm hệ thống để đảm bảo hoạt động ổn định, tối ưu.Hỗ trợ bảo hành, bảo trì, xử lý sự cố kỹ thuật sau bàn giao.4. Hỗ trợ khách hàng & phát triển công tyTư vấn, khảo sát, lắp đặt hệ thống theo nhu cầu khách hàng.Kiểm tra và khắc phục sự cố tại hiện trường khi có yêu cầu.Báo cáo công việc cho cấp quản lý, phối hợp cùng đội ngũ triển khai để nâng cao chất lượng dịch vụ.",https://www.topcv.vn/viec-lam/ky-thuat-vien-cong-nghe-thong-tin/1927430.html?ta_source=ITJobs_LinkDetail,Thoả thuận,CÔNG TY TNHH SMYOU,https://www.topcv.vn/cong-ty/cong-ty-tnhh-smyou/61783.html,Cập nhật 1 tuần trước,Còn17ngày để ứng tuyển,"Kiến Thức Về Phần Cứng Máy Tính, Kiến Thức Về Hệ Điều Hành (windows, Macos, Linux), Khả Năng Chẩn Đoán Và Khắc Phục Sự Cố Phần Cứng Phần Mềm, 2+",Hồ Chí Minh
1927434,Tìm Kiếm Factory Project Manager (FPM),N/A,22.0,40.0,3.0,3.0,Thái Nguyên,,"Lập kế hoạch tổng thể cho dự án quản lý vật liệu trong giai đoạn NPI, bao gồm mục tiêu, tiến độ, phân bổ nguồn lực và ngân sách.Là đầu mối phối hợp giữa các bộ phận (R&D, Mua hàng, Sản xuất, Kho vận…) để thu thập, phân tích và thực hiện yêu cầu quản lý vật liệu.Quản lý mối quan hệ với nhà cung cấp, đảm bảo nguồn vật liệu đúng tiến độ và chất lượng.Theo dõi tiến độ, giám sát chất lượng, phát hiện và xử lý các rủi ro tiềm ẩn trong dự án.Đề xuất và triển khai các biện pháp cải tiến quy trình, nâng cao hiệu quả vận hành.Báo cáo tiến độ, kết quả thực hiện dự án cho ban quản lý nhà máy.",https://www.topcv.vn/viec-lam/tim-kiem-factory-project-manager-fpm/1927434.html?ta_source=ITJobs_LinkDetail,22 - 40 triệu,CÔNG TY TNHH RQ TECHNOLOGY ELECTRONICS VIỆT NAM,https://www.topcv.vn/cong-ty/cong-ty-tnhh-rq-technology-electronics-viet-nam/170754.html,Cập nhật 1 tuần trước,Còn17ngày để ứng tuyển,"Lập Kế Hoạch, Quản Lý Sản Xuất, Kiểm Soát Chất Lượng, 12+",Thái Nguyên
1819135,Middle Golang,N/A,,24.0,3.0,3.0,Hồ Chí Minh,,"Một lập trình viên làm việc triển khai các thành phần backend, bao gồm các chức năng logic nghiệp vụ, mô hình dữ liệu/lưu trữ dữ liệu, các quy tắc nghiệp vụ, các chức năng theo lịch/trình tự tự động, sự kiện, cổng/giao diện. Vai trò này làm việc chặt chẽ với Scrum Master, Product Owners, kỹ sư QA, Solution Architects và Chapter Lead.Vai trò này không chỉ chịu trách nhiệm viết mã mà còn chịu trách nhiệm về tài liệu, triển khai mã lên môi trường sản xuất và hỗ trợ sau triển khai.",https://www.topcv.vn/viec-lam/middle-golang/1819135.html?ta_source=ITJobs_LinkDetail,Tới 24 triệu,Công ty cổ phần Aequitas,https://www.topcv.vn/cong-ty/cong-ty-co-phan-aequitas/216860.html,Cập nhật 1 tuần trước,Còn17ngày để ứng tuyển,"Golang, software development, algorithms, 2+",Hồ Chí Minh
1927398,System Integration Officer,N/A,,,,,Hồ Chí Minh,,"The primary objective of this role is to support the IT Application & System Integration Specialist in managing, maintaining, and developing software systems. This includes assisting with user support, training, and system integration tasks.1. System Support:Assist in administering assigned software systems to ensure they operate efficiently.Help perform regular system updates and maintenance tasks.Support monitoring system performance and troubleshooting any issues.2. User Support and Training:Assist in providing guidance and training to users.Help develop and execute training plans for new software applications.Offer ongoing user support and address usage issues promptly.3. Solution implementation: Assist in identifying and implementing improvements in business processes through technology.4. Project assistance: (Mobile App, POP, CRM, One App)Support the management of software development projects from inception to completion.Ensure projects are delivered on time, within budget, and meet the required standards.5. Documentation:Help organize and manage all relevant documentation including system design, user manuals, and training materials.Ensure all documentation is up-to-date and accessible to relevant stakeholders.",https://www.topcv.vn/viec-lam/system-integration-officer/1927398.html?ta_source=ITJobs_LinkDetail,Thoả thuận,Công ty TNHH AEON Việt Nam,https://www.topcv.vn/cong-ty/cong-ty-tnhh-aeon-viet-nam/198911.html,Cập nhật 1 tuần trước,Còn17ngày để ứng tuyển,"Quản Lý Dự Án, Thiết Kế Hệ Thống, Triển Khai Hệ Thống, 2+",Hồ Chí Minh
1927381,Kỹ Sư IT Phần Mềm,N/A,20.0,33.0,2.0,2.0,Hà Nam,,"1. Bảo trì và xử lý sự cố hệ thống ERP ORACLE.2. Phát triển tùy chỉnh cho hệ thống ERP ORACLE.3. Phân tích và lập kế hoạch các yêu cầu quy trình làm việc của ERP ORACLE.4. Phát triển các hệ thống doanh nghiệp nội bộ và các chương trình ERP tùy chỉnh.5. Giao tiếp và phối hợp giữa các phòng ban, am hiểu các mô-đun và quy trình làm việc của Oracle ERP, giải quyết các vấn đề của người dùng.",https://www.topcv.vn/viec-lam/ky-su-it-phan-mem/1927381.html?ta_source=ITJobs_LinkDetail,"800 - 1,300 USD",CÔNG TY TNHH NEWEB VIỆT NAM,https://www.topcv.vn/cong-ty/cong-ty-tnhh-neweb-viet-nam/146225.html,Cập nhật 1 tuần trước,Còn23ngày để ứng tuyển,"Kiểm thử phần mềm, Phân Tích Và Thiết Kế Hệ Thống, Cấu Trúc Dữ Liệu Và Giải Thuật, 2+",Hà Nam
1702022,IT Helpdesk,N/A,9.0,11.0,1.0,1.0,Hồ Chí Minh,,"Đảm bảo, duy trì hệ thống công nghệ thông tin; kiểm tra tư vấn sửa chữa các thiết bị phần cứng CNTT, thiết bị văn phòng: NAS, máy in, wifi, camera cho nội bộ và khách hàng.Xác định, chẩn đoán và hỗ trợ người dùng các sự cố về máy tính, tư vấn nâng cấp hệ thống hoặc thiết bị thay thế.Thiết lập hệ thống mạng nội bộ cho công ty và khách hàng: Hệ thống lưu trữ NAS Synology, cấu hình modem, hệ thống wifi, switch, các thiết bị mạng. Đảm bảo hệ thống luôn được vận hành ổn định.Làm việc với các nhà cung cấp về vấn đề bảo hành, bảo trì các thiết bị công nghệ thông tin.Hỗ trợ, phản hồi các vấn đề của khách hàng trên các kênh online và trực tiếp theo sự vụ.",https://www.topcv.vn/viec-lam/it-helpdesk/1702022.html?ta_source=ITJobs_LinkDetail,9 - 11 triệu,CÔNG TY TNHH THƯƠNG MẠI DỊCH VỤ VI TÍNH SAO MAI,https://www.topcv.vn/cong-ty/cong-ty-tnhh-thuong-mai-dich-vu-vi-tinh-sao-mai/205950.html,Cập nhật 1 tuần trước,Còn23ngày để ứng tuyển,"Giải quyết vấn đề, Khắc Phục Sự Cố Máy Tính, Kiến Thức Về Phần Cứng Máy Tính, 2+",Hồ Chí Minh
1384176,Game Tester,N/A,26.0,39.0,3.0,3.0,Hồ Chí Minh,,"Responsibility:●  Execute comprehensive quality assurance tests on software applications, game mobile app to identify defects, anomalies, and areas for improvement.●  Collaborate with software development teams to develop detailed test plans and test cases based on project requirements and technical specifications.●  Conduct various types of testing, including functional, regression, performance, and security testing, to validate the functionality and reliability of IT systems.●  Report and track defects and issues using a designated bug-tracking system. Work closely with developers to resolve and retest defects.●  Document test procedures, results, and any deviations from quality standards. Prepare test summary reports.●  Ensure compliance with IT quality standards, industry best practices, and security regulations.●  Collaborate with IT teams to identify areas for process improvement and participate in process enhancement initiatives.●  Other tasks assigned by Line Manager.",https://www.topcv.vn/viec-lam/game-tester/1384176.html?ta_source=ITJobs_LinkDetail,"1,000 - 1,500 USD",Công ty TNHH Rainbow 5S,https://www.topcv.vn/cong-ty/cong-ty-tnhh-rainbow-5s/155679.html,Cập nhật 1 tuần trước,Còn54ngày để ứng tuyển,"Tester, QC/QA, Kiểm Thử, 2+",Hồ Chí Minh
1386599,Game Developer ( Cocos Creator ),N/A,52.0,52.0,4.0,4.0,Hồ Chí Minh,,"Designing and implementing code that is fit for purpose, scalable, human-readable, and in line with industry best practice.
Quality control of the entire product lifecycle by testing intuitiveness, user experience, and debugging where necessary.
Communicating with clients to understand their business goals and objectives, and interpreting that into the required changes to the platform where necessary.
Liaising with other developers, designers, and system administrators to identify new features and create relevant prototypes for new product ideas.
Deploying production code.
Communicating the effectiveness of emerging technologies to decision-makers.
Working on full production cycles from brainstorming and rapid prototyping to developing fully fledged systems and fine-tuning mechanics, as well as stress testing and bug fixing.
Developing innovative gameplay, AI, physics, UI, vehicles, weapons, and character controls.
Solving technical problems with simple, efficient, and creative code.
Helping ship game projects across multiple platforms on Web, iOS and Android.
Providing feedback and advice to junior team members. 
Other tasks assigned by Line Manager.",https://www.topcv.vn/viec-lam/game-developer-cocos-creator/1386599.html?ta_source=ITJobs_LinkDetail,"Từ 2,000 USD",Công ty TNHH Rainbow 5S,https://www.topcv.vn/cong-ty/cong-ty-tnhh-rainbow-5s/155679.html,Cập nhật 1 tuần trước,Còn54ngày để ứng tuyển,"Cocos2D, Unity, Cocos2d-x, 1+",Hồ Chí Minh
1919008,Software Engineer (Fullstack Java/Reactjs),N/A,,31.0,3.0,3.0,Hà Nội,,"Phát triển phần mềm, thực hiện kiểm thử nội bộ, viết tài liệu kỹ thuật và triển khai ứng dụng trên các môi trường khác nhauPhân tích nguyên nhân sự cố, tối ưu từ người dùng hoặc các ứng dụng tích hợp của đối tác, đề xuất phương án xử lý tối ưu.Tham gia phân tích, thiết kế và đưa ra giải pháp kỹ thuật dựa trên tài liệu yêu cầu nghiệp vụ.Xác định và rà soát các vấn đề thường xuyên phát sinh lỗi, xây dựng phương án khắc phục triệt để và giám sát thực thi.Phối hợp với các thành viên trong đội dự án (BA, QA, DevOps, Product Owner,…) để hoàn thiện sản phẩm.",https://www.topcv.vn/viec-lam/software-engineer-fullstack-java-reactjs/1919008.html?ta_source=ITJobs_LinkDetail,"Tới 1,200 USD",CÔNG TY TNHH VETC DIGITAL,https://www.topcv.vn/cong-ty/cong-ty-tnhh-vetc-digital/235225.html,Cập nhật 1 tuần trước,Còn12ngày để ứng tuyển,"Java, ReactJS, RESTful APIs, 2+",Hà Nội
1835045,"Fullstack Developer (.NET, React, SQL, C#)",N/A,,39.0,2.0,2.0,Hà Nội,,"VỀ AWINGAWING là công ty công nghệ về quảng cáo tiên phong xây dựng một kênh truyền thông (media platform) hoàn toàn mới tại Việt Nam và Đông Nam Á – không dựa vào nội dung để tạo traffic, mà sử dụng công nghệ và dữ liệu vị trí người dùng thực tế kích hoạt sự chú ý đúng thời điểm, đúng vị trí – nơi hành vi tiêu dùng thật sự diễn ra để tạo ra kết nối hiệu quả giữa thương hiệu và hơn 40 triệu người tiêu dùng trên nền tảng.Với sự đầu tư chiến lược từ NTT e-Asia (thuộc tập đoàn NTT – Top 4 tập đoàn viễn thông – CNTT lớn nhất thế giới), AWING đang mở rộng mạnh mẽ trong khu vực ASEAN và từng bước định hình một chuẩn mới cho kênh quảng cáo gắn liền tiêu dùng cao ở mỗi quốc gia. Vị trí Full-stack Developer là cơ hội tuyệt vời để bạn tham gia vào hành trình đưa sản phẩm công nghệ “Made in Vietnam” vươn ra thị trường quốc tế.CHI TIẾT CÔNG VIỆCTham gia vào quy trình phân tích, thiết kế và phát triển các sản phẩm phần mềm của công ty.Phối hợp chặt chẽ với đội ngũ backend để tích hợp giao diện người dùng với các API.Tối ưu hóa hiệu suất hệ thống nhằm đảm bảo tốc độ truy cập cao và tiết kiệm tài nguyên.Nghiên cứu và áp dụng các công nghệ mới nhằm cải tiến và nâng cao chất lượng sản phẩm.Xây dựng và duy trì cơ sở dữ liệu, đảm bảo tính bảo mật và hiệu suất.Viết và duy trì tài liệu kỹ thuật và tài liệu hướng dẫn sử dụng.Thực hiện kiểm thử và gỡ lỗi (debug) để đảm bảo sản phẩm hoạt động ổn định và không có lỗi.Hỗ trợ và giải quyết các vấn đề kỹ thuật phát sinh trong quá trình vận hành sản phẩm.Đóng góp ý tưởng và giải pháp để cải tiến quy trình phát triển và tối ưu hóa hệ thống.",https://www.topcv.vn/viec-lam/fullstack-developer-net-react-sql-c/1835045.html?ta_source=ITJobs_LinkDetail,"Tới 1,500 USD",CÔNG TY CỔ PHẦN CÔNG NGHỆ VÀ TRUYỀN THÔNG AWING VIỆT NAM,https://www.topcv.vn/cong-ty/cong-ty-co-phan-cong-nghe-va-truyen-thong-awing-viet-nam/103313.html,Cập nhật 1 tuần trước,Còn23ngày để ứng tuyển,".NET, C#, SQL, 3+",Hà Nội
1871851,Code Engineer Cum Website Maintaining Operation,N/A,,,2.0,2.0,"Bình Dương, Hồ Chí Minh",,Thiết kế và phát triển các trang web hiện có và tối ưu hóa hiệu suất của các hệ thống dữ liệu hiện có.Phát triển và triển khai các mô hình dữ liệu phù hợp với nhu cầu kinh doanh.Hỗ trợ các nhóm khác trong việc truy xuất và phân tích dữ liệu.Viết tài liệu kỹ thuật và hướng dẫn sử dụng cho các hệ thống dữ liệu hoặt phần mềm.Đảm bảo chất lượng dữ liệu và tuân thủ các quy định về bảo mật dữ liệu.,https://www.topcv.vn/viec-lam/code-engineer-cum-website-maintaining-operation/1871851.html?ta_source=ITJobs_LinkDetail,Thoả thuận,Công ty TNHH TM DV Nghị Tín,https://www.topcv.vn/cong-ty/cong-ty-tnhh-tm-dv-nghi-tin/26196.html,Cập nhật 1 tuần trước,Còn18ngày để ứng tuyển,"Lập Trình, Quản Lý Phiên Bản (git), Kiến Thức Về Cơ Sở Dữ Liệu, 2+","Bình Dương, Hồ Chí Minh"
1926864,Trưởng Bộ Phận Kỹ Thuật Bảo Hành,N/A,18.0,22.0,2.0,2.0,Hà Nội,,"Xây dựng và vận hành quy trình tiếp nhận, xử lý bảo hành, bảo trì và các dịch vụ hậu mãi sau bán hàng.Quản lý, đào tạo đội ngũ nhân viên, phân công công việc và giám sát thực hiện công việc.Làm việc và đàm phán với các hãng, nhà cung cấp dịch vụ kỹ thuật để đảm bảo chính sách bảo hành đúng cam kết.Phối hợp với bộ phận chăm sóc khách hàng để xử lý khiếu nại, phản hồi từ khách hàngLập báo cáo định kỳ về tình hình bảo hành, tỷ lệ lỗi sản phẩm, thời gian xử lý dịch vụ.Theo dõi, đánh giá chất lượng dịch vụ sau bán hàng, đề xuất cải tiến để nâng cao trải nghiệm khách hàng.Thực hiện các công việc theo phân công của BGĐ",https://www.topcv.vn/viec-lam/truong-bo-phan-ky-thuat-bao-hanh/1926864.html?ta_source=ITJobs_LinkDetail,18 - 22 triệu,Công ty TNHH Thương mại Dịch vụ Tin học An Phát,https://www.topcv.vn/cong-ty/cong-ty-tnhh-thuong-mai-dich-vu-tin-hoc-an-phat/114782.html,Cập nhật 1 tuần trước,Còn17ngày để ứng tuyển,"Kỹ năng giao tiếp, Quản Lý Đội Nhóm, Khả năng giải quyết vấn đề, 2+",Hà Nội
1887680,Chuyên Viên Dự Án - Chuyển Đổi Số,N/A,11.0,15.0,2.0,2.0,Hồ Chí Minh,,"Lập kế hoạch và triển khai dự án:- Phối hợp với các phòng ban liên quan để đưa ra đánh giá tính hiệu quả của kế hoạch chuyển đổi số.- Theo dõi tiến độ thực hiện, đảm bảo các hạng mục được hoàn thành đúng thời gian và ngân sách đã đề ra.Điều phối và giám sát dự án:- Điều hành các phòng ban thực hiện theo kế hoạch chuyển đổi số.- Theo sát tiến độ, phát hiện và đề xuất giải pháp xử lý khi có rủi ro hoặc sự cố phát sinh.Làm việc với đối tác và nhà cung cấp:- Phối hợp làm việc với nhà cung cấp để đảm bảo yêu cầu kỹ thuật và tiến độ.- Tham gia đàm phán các điều khoản kỹ thuật, lịch trình thực hiện (nếu được phân công).",https://www.topcv.vn/viec-lam/chuyen-vien-du-an-chuyen-doi-so/1887680.html?ta_source=ITJobs_LinkDetail,11 - 15 triệu,CÔNG TY TRÁCH NHIỆM HỮU HẠN MỘT THÀNH VIÊN TÍN NHA,https://www.topcv.vn/cong-ty/cong-ty-trach-nhiem-huu-han-mot-thanh-vien-tin-nha/220232.html,Cập nhật 1 tuần trước,Còn18ngày để ứng tuyển,"phân tích số liệu, Lập Kế Hoạch, Quản Lý Dự Án, 7+",Hồ Chí Minh
1569013,Flutter Developer,N/A,15.0,20.0,2.0,2.0,Hà Nội,,"Tham gia quá trình thiết kế hệ thống, phát triển, vận hành tối ưu cho các ứng dụng Mobile App ( Android & IOS). Triển khai các yêu cầu chức năng bổ trợ, update và cải tiến cho các ứng dụng Mobile.Kết hợp cùng các team khác trong việc review, đánh giá, mở rộng ứng dụng.",https://www.topcv.vn/viec-lam/flutter-developer/1569013.html?ta_source=ITJobs_LinkDetail,15 - 20 triệu,CÔNG TY TNHH HORUS PRODUCTIONS,https://www.topcv.vn/cong-ty/cong-ty-tnhh-horus-productions/179887.html,Cập nhật 1 tuần trước,Còn23ngày để ứng tuyển,"Git, Dart, REST APIs, 2+",Hà Nội
