job_id,job_title,company,salary_min,salary_max,yrs_of_exp_min,yrs_of_exp_max,job_city,due_date,jd,job_url,salary_text,company_name,company_link,updated_at,time_left,tags,location
1705395,Cloud System Engineer (GCP),N/A,,,1.0,1.0,Hà Nội,,"Infrastructure Management: Deploy and manage the cloud infrastructure on Google Cloud Platform (GCP) including services like Compute Engine, Cloud Storage, Cloud VPC, Cloud SQL, and Google Kubernetes Engine (GKE).
Automation: Implement automation of cloud infrastructure provisioning and management using Terraform, Google Cloud Deployment Manager, and Cloud SDK.
Monitoring & Optimization: Monitor cloud infrastructure health and performance using Google Cloud Monitoring and Stackdriver, and perform ongoing performance tuning to ensure optimal resource usage and cost efficiency.
Security & Compliance: Enforce best practices in cloud security, including identity and access management (IAM), encryption, and network security to ensure data protection and compliance.
Incident Management: Troubleshoot and resolve infrastructure-related incidents, ensuring minimal downtime and providing root cause analysis.
Cost Management: Utilize GCP tools and reports to manage cloud costs and optimize usage, ensuring the infrastructure is running efficiently and cost-effectively.
Documentation: Maintain clear and detailed documentation for infrastructure setups, processes, and troubleshooting guidelines to support ongoing operations and future scaling
OS: Have experience in upgrading OS, managing service running on Serve",https://www.topcv.vn/viec-lam/cloud-system-engineer-gcp/1705395.html?ta_source=ITJobs_LinkDetail,Thoả thuận,Công Ty TNHH LG CNS VIỆT NAM,https://www.topcv.vn/cong-ty/cong-ty-tnhh-lg-cns-viet-nam/139535.html,Cập nhật 3 ngày trước,Còn27ngày để ứng tuyển,,Hà Nội
1785778,Database Engineer (DBA),N/A,,,,1.0,Hà Nội,,"Design and build Database in Public Cloud environments such as AWS, GCP, and Azure
Operate Databases in Public Cloud Environments Such As AWS, GCP, and Azure
Perform DBMS OBJECT change management such as Table, Index, VIEW, Procecure, etc.
SQL performance tuning on databases such as Mysql, Mariadb, Postgresql, Oracle, and more",https://www.topcv.vn/viec-lam/database-engineer-dba/1785778.html?ta_source=ITJobs_LinkDetail,Thoả thuận,Công Ty TNHH LG CNS VIỆT NAM,https://www.topcv.vn/cong-ty/cong-ty-tnhh-lg-cns-viet-nam/139535.html,Cập nhật 3 ngày trước,Còn27ngày để ứng tuyển,,Hà Nội
1938091,System Engineer / ITO Engineer,N/A,,,2.0,2.0,Đà Nẵng,,"•	Manage and operate Microsoft 365 services including Teams Phone, SharePoint, Intune, Exchange Online, and Azure AD.
•	Receive, analyze, and resolve technical issues reported by end-users or monitoring systems.
•	Design and implement CI/CD pipelines for applications integrated with Microsoft 365 and Power Platform.
•	Develop and maintain solutions using Power Apps, Power Automate, and Power BI to support business operations.
•	Collaborate with cross-functional teams to ensure system stability, performance, and security.
•	Document incidents, solutions, and system changes in ticketing and knowledge management systems.
•	Participate in system monitoring, patching, and routine maintenance tasks.",https://www.topcv.vn/viec-lam/system-engineer-ito-engineer/1938091.html?ta_source=ITJobs_LinkDetail,Thoả thuận,Công ty Cổ phần NTTe-MOI,https://www.topcv.vn/cong-ty/cong-ty-co-phan-ntte-moi/167746.html,Cập nhật 3 ngày trước,Còn27ngày để ứng tuyển,,Đà Nẵng
1919487,"Chuyên Gia, Chuyên Viên Cao Cấp Kiến Trúc Ứng Dụng - Solution Architect - Khối Công Nghệ Thông Tin (HOLT.10)",NGÂN HÀNG TMCP QUÂN ĐỘI – MBBANK,,,,,"18 Lê Văn Lương, Cầu Giấy",2025-11-20,N/A,https://www.topcv.vn/brand/nganhangthuongmaicophanquandoi/tuyen-dung/chuyen-gia-chuyen-vien-cao-cap-kien-truc-ung-dung-solution-architect-khoi-cong-nghe-thong-tin-holt-10-j1919487.html?ta_source=ITJobs_LinkDetail,Thoả thuận,NGÂN HÀNG TMCP QUÂN ĐỘI – MBBANK,https://www.topcv.vn/brand/nganhangthuongmaicophanquandoi?id=198860,Cập nhật 3 ngày trước,Còn13ngày để ứng tuyển,,Hà Nội
1920037,"Angular Developer (Product, Có Signing Bonus)",N/A,20.0,35.0,3.0,3.0,Hà Nội,,"Về KiotViet:Sản phẩm công nghệ của KiotViet được nghiên cứu và sáng tạo tại Việt Nam, bởi kỹ sư phần mềm Việt, dựa vào đóng góp từ hàng trăm nghìn chủ doanh nghiệp, với sứ mệnh mang lại giá trị cho cộng đồng kinh doanh lớn nhỏ trên khắp mọi miền tổ quốc và các quốc gia đang trên đà phát triển hưng thịnh. KiotViet cam kết đồng hành cùng cộng đồng kinh doanh vừa, nhỏ và siêu nhỏ.Với hơn 13 năm và trên 1,500 con người để tạo nên một KiotViet của ngày hôm nay, chúng tôi hiểu rằng các thành viên, từ quá khứ tới tương lai, là nền tảng cho KiotViet của ngày hôm nay và bệ phóng để vươn tới một KiotViet của ngày mai. KiotViet cam kết một môi trường làm việc chia sẻ thành công, cùng chung trách nhiệm.Bạn sẽ làm gì- Phát triển và bảo trì ứng dụng web sử dụng framework Angular;- Tạo các single-page application interactive và hiệu suất cao;- Implement logic ứng dụng theo system specifications;- Tích hợp RESTful API services với ứng dụng frontend;- Debug và fix các vấn đề để đảm bảo performance tối ưu của ứng dụng;- Optimize ứng dụng để đạt tốc độ và tính năng tối đa;- Cộng tác với các thành viên team để định nghĩa, thiết kế và triển khai tính năng mới;- Tham gia code reviews và duy trì code quality;- Cập nhật kiến thức về những phát triển mới nhất của Angular và best practices;- Viết documentation cho code và quy trình phát triển.",https://www.topcv.vn/viec-lam/angular-developer-product-co-signing-bonus/1920037.html?ta_source=ITJobs_LinkDetail,20 - 35 triệu,Công ty Cổ phần Công nghệ KiotViet,https://www.topcv.vn/cong-ty/cong-ty-co-phan-cong-nghe-kiotviet/136233.html,Cập nhật 3 ngày trước,Còn12ngày để ứng tuyển,"CSS, HTML, Javascript, 2+",Hà Nội
477657,Chuyên Viên Kiểm Thử - Tester (Auto Test),N/A,18.0,32.0,2.0,2.0,Hà Nội,,"Thiết kế và thực hiện kế hoạch kiểm thử tự động, các trường hợp, kịch bản và quy trình kiểm thử trên các ứng dụng phần mềm dựa trên yêu cầu nghiệp vụ và đặc tính kỹ thuật.• Xác định các lỗi phần mềm để gắn cờ và chẩn đoán các lỗi và duy trì cơ sở dữ liệu về các lỗi phần mềm.• Sử dụng phân tích lịch sử các kết quả kiểm tra để xác định các vấn đề và các lĩnh vực cải tiến.• Tiến hành Kiểm tra Chức năng trên các ứng dụng mới và các cải tiến phần mềm hiện có để đảm bảo chúng đáp ứng các yêu cầu kinh doanh thông qua việc thực hiện các bài kiểm tra kịch bản kinh doanh từ đầu đến cuối.• Tiến hành Kiểm tra hồi quy trên các ứng dụng mới và các cải tiến phần mềm hiện có để xác định bất kỳ tác động nào có thể xảy ra do các thay đổi gây ra.",https://www.topcv.vn/viec-lam/chuyen-vien-kiem-thu-tester-auto-test/477657.html?ta_source=ITJobs_LinkDetail,18 - 32 triệu,Công ty Cổ phần SIMBATECH,https://www.topcv.vn/cong-ty/cong-ty-co-phan-simbatech/32829.html,Cập nhật 3 ngày trước,Còn23ngày để ứng tuyển,"Agile, C#, Java, 7+",Hà Nội
825359,"Nhân Viên Kỹ Thuật Máy In, Máy Photocopy",N/A,6.0,10.0,,,Đồng Nai,,"– Cài đặt & hướng dẫn khách hàng sử dụng máy photocopy, máy in, các loại máy văn phòng, share máy in trong mạng lan.– Chuẩn đoán xử lý sự cố máy tính và máy in: Thay, nạp mực, thay thế linh kiện cần thiết, vật tư cho các dòng máy photocopy, máy in.– Hỗ trợ cài in qua teamview, ultraview.– Bảo trì máy photocopy, máy in theo quy trình định kỳ.– Chốt counter hàng tháng tại công ty khách hàng.– Sửa chữa, dọn và vệ sinh máy in, máy photocopy.Sao lưu dữ liệu, cài đặt windows và phần mềm theo yêu cầu.– Thay thế, linh kiện máy tính PC, laptop, máy in, máy photocopy.– Sửa mạng lan, wan cho doanh nghiệp",https://www.topcv.vn/viec-lam/nhan-vien-ky-thuat-may-in-may-photocopy/825359.html?ta_source=ITJobs_LinkDetail,6 - 10 triệu,CÔNG TY CỔ PHẦN ĐẦU TƯ RES,https://www.topcv.vn/cong-ty/cong-ty-co-phan-dau-tu-res/87251.html,Cập nhật 3 ngày trước,Còn13ngày để ứng tuyển,"Word, Excel, Microsoft Office, 2+",Đồng Nai
1919563,Middle Manual Tester (QA/QC) - EN Đọc Hiểu,N/A,,25.0,3.0,3.0,Hà Nội,,"Tham gia phân tích và làm rõ yêu cầu hệ thống phần mềm của dự án.Thiết kế kế hoạch test, kịch bản test, test case, test script và test data.Tạo dữ liệu kiểm thử, thiết lập và quản lý môi trường kiểm thử.Thực hiện kiểm thử theo kế hoạch: functional, regression, integration test.Kiểm thử API (Postman, Swagger), database (SQL nâng cao).Ghi nhận, phân tích và theo dõi bug; kiểm soát việc sửa lỗi của đội phát triển.Viết báo cáo test, đánh giá kết quả kiểm thử và đề xuất cải tiến chất lượng.Phối hợp chặt chẽ với BA/Dev và hỗ trợ training cho Fresher/Junior.Nghiên cứu, áp dụng automation (Selenium, Playwright, Cypress…) hoặc performance testing (JMeter, k6) khi cần thiết.",https://www.topcv.vn/viec-lam/middle-manual-tester-qa-qc-en-doc-hieu/1919563.html?ta_source=ITJobs_LinkDetail,Tới 25 triệu,Newwave Solutions JSC,https://www.topcv.vn/cong-ty/newwave-solutions-jsc/14514.html,Cập nhật 3 ngày trước,Còn12ngày để ứng tuyển,"Kiến Thức Về Quy Trình Kiểm Thử Phần Mềm, Kỹ Năng Viết Test Case, Kỹ Năng Thực Hiện Kiểm Thử (manual Và Automation), 2+",Hà Nội
1918754,"Unity Developer (Kinh Nghiệm 1 Năm, Tốt Nghiệp ĐH Bách Khoa HN) - Lương Upto 30 Triệu+Thưởng Dự Án, Làm Việc Với Game Publishers Lớn",N/A,10.0,30.0,1.0,1.0,Hà Nội,,"Lập trình, thiết kế các dự án dòng game Puzzle trên nền tảng UnityNghiên cứu các công nghệ mới ứng dụng cho gamePhối hợp các bộ phận khác (Art, Anim, Game Design, Effect,...) để phát triển và tối ưu game",https://www.topcv.vn/viec-lam/unity-developer-kinh-nghiem-1-nam-tot-nghiep-dh-bach-khoa-hn-luong-upto-30-trieu-thuong-du-an-lam-viec-voi-game-publishers-lon/1918754.html?ta_source=ITJobs_LinkDetail,10 - 30 triệu,Công ty TNHH NGen,https://www.topcv.vn/cong-ty/cong-ty-tnhh-ngen/151816.html,Cập nhật 3 ngày trước,Còn23ngày để ứng tuyển,"C#, Unity, Git",Hà Nội
1918156,Unity Developer,N/A,15.0,20.0,2.0,2.0,Hà Nội,,"Tham gia phát triển, tối ưu và bảo trì các tựa game trên nền tảng mobile/PC sử dụng Unity.Thiết kế và lập trình các thành phần gameplay, UI/UX, và xử lý logic trong game.Phát triển các tính năng Multiplayer/Realtime như: matchmaking, phòng chơi, chat, bảng xếp hạng (ranking),...Tối ưu hiệu suất game, đảm bảo trải nghiệm mượt mà trên nhiều thiết bị và cấu hình khác nhau.Phối hợp chặt chẽ với các bộ phận Game Designer, Artist, và Backend Developer để xây dựng và hoàn thiện sản phẩm.Tham gia nghiên cứu, đánh giá và đề xuất ứng dụng công nghệ, engine game mới như Unity, Cocos,...",https://www.topcv.vn/viec-lam/unity-developer/1918156.html?ta_source=ITJobs_LinkDetail,15 - 20 triệu,CÔNG TY CỔ PHẦN CROW GAMING,https://www.topcv.vn/cong-ty/cong-ty-co-phan-crow-gaming/166325.html,Cập nhật 3 ngày trước,Còn23ngày để ứng tuyển,"Giải quyết vấn đề, Lập Trình C#, Kiến Thức Về Thuật Toán Và Cấu Trúc Dữ Liệu, 2+",Hà Nội
1919945,QA Executive (Mid Level),N/A,,,2.0,2.0,Hồ Chí Minh,,"Design test plan and test schedule for the projects.Write test cases, test scripts, test APIs based on specification documents.Execute non-functional test scenarios in addition to functional test cases.Identify, analyze and report the test results.Identify the root cause of quality problems, and coordinate modifications or other corrective actions.Automate tests for the user interface of web and mobile applications using frameworks like Selenium (for web), Appium (for mobile), or Playwright.Other tasks assigned by the Line Manager.",https://www.topcv.vn/viec-lam/qa-executive-mid-level/1919945.html?ta_source=ITJobs_LinkDetail,Thoả thuận,CALIBEE,https://www.topcv.vn/cong-ty/calibee/130396.html,Cập nhật 3 ngày trước,Còn12ngày để ứng tuyển,"Kiến Thức Về Kiểm Thử Phần Mềm, Kỹ Năng Lập Trình (java, Python, C#), Kỹ Năng Viết Test Case Và Test Script, 14+",Hồ Chí Minh
1919504,AI Engineer (Computer Vision/NPL/LLM) - Khối Công Nghệ Thông Tin (HOLT.13),NGÂN HÀNG TMCP QUÂN ĐỘI – MBBANK,15.0,35.0,3.0,3.0,"Số 18 Lê Văn Lương, phường Trung Hòa, Cầu Giấy",2025-11-20,N/A,https://www.topcv.vn/brand/nganhangthuongmaicophanquandoi/tuyen-dung/ai-engineer-computer-vision-npl-llm-khoi-cong-nghe-thong-tin-holt-13-j1919504.html?ta_source=ITJobs_LinkDetail,15 - 35 triệu,NGÂN HÀNG TMCP QUÂN ĐỘI – MBBANK,https://www.topcv.vn/brand/nganhangthuongmaicophanquandoi?id=198860,Cập nhật 3 ngày trước,Còn13ngày để ứng tuyển,"API, Python, C/C++, Reinforcement Learning, 1+",Hà Nội
1919194,Chuyên Viên Công Nghệ Thông Tin - Phụ Trách Chuyển Đổi Số Trong Sản Xuất,N/A,,,2.0,2.0,Hà Nội,,"•	Nghiên cứu, đề xuất chiến lược chuyển đổi số phù hợp với định hướng phát triển của công ty. Phối hợp các phòng ban để khảo sát hiện trạng, phân tích nhu cầu và đề xuất giải pháp công nghệ.
•	Xây dựng lộ trình số hóa quy trình sản xuất, quản trị và kinh doanh (MES, ERP, CRM, HRM...). 
•	Triển khai, quản lý và đánh giá hiệu quả các phần mềm quản trị (ERP, MES, PLM, TMS...). 
•	Đề xuất giải pháp IoT, AI, RPA... để tối ưu vận hành.
•	Giám sát việc tích hợp dữ liệu và tự động hóa các công đoạn sản xuất may mặc, quản lý kho, bán hàng.
•	Thiết lập, chuẩn hóa và quản lý hệ thống cơ sở dữ liệu tập trung. Đảm bảo an toàn thông tin và bảo mật dữ liệu.
•	Hỗ trợ kỹ thuật, giải đáp sự cố liên quan đến hệ thống CNTT và phần mềm quản lý. Đào tạo nhân viên các phòng ban về kỹ năng sử dụng hệ thống số hóa.
•	Đề xuất các cải tiến công nghệ mới, phù hợp với đặc thù ngành may mặc, bảo hộ và đồng phục. Theo dõi xu hướng công nghệ và cập nhật kịp thời vào hoạt động sản xuất – kinh doanh.",https://www.topcv.vn/viec-lam/chuyen-vien-cong-nghe-thong-tin-phu-trach-chuyen-doi-so-trong-san-xuat/1919194.html?ta_source=ITJobs_LinkDetail,Thoả thuận,CÔNG TY CỔ PHẦN X20,https://www.topcv.vn/cong-ty/cong-ty-co-phan-x20/203117.html,Cập nhật 3 ngày trước,Còn13ngày để ứng tuyển,,Hà Nội
1919000,Thực Tập Sinh Unity Developer,N/A,2.0,3.0,,,Hà Nội,,"Phát triển game 2D/3D trên nền tảng UnityTham gia các dự án về game. Dev bằng Unity và các phần mềm lập trình khác.Phối hợp với các thành viên trong team để hoàn thiện và tối ưu game: animation, UI, UX...Đóng góp ý tưởng nội dung công việc.",https://www.topcv.vn/viec-lam/thuc-tap-sinh-unity-developer/1919000.html?ta_source=ITJobs_LinkDetail,2 - 3 triệu,CÔNG TY TNHH KINH DOANH TỔNG HỢP TUẤN PHÁT,https://www.topcv.vn/cong-ty/cong-ty-tnhh-kinh-doanh-tong-hop-tuan-phat/180289.html,Cập nhật 3 ngày trước,Còn12ngày để ứng tuyển,"C#, Unity, Lập Trình Hướng Đối Tượng (oop), 2+",Hà Nội
1767391,Lập Trình Frontend,N/A,,,3.0,3.0,Hà Nội,,"Phát triển các chức năng front-end cho website và ứng dụng web.Tập trung vào các hệ thống bán hàng đa kênh, mua sắm tập trung, POS và giải pháp ngân hàng.Thực hiện các công việc khác theo yêu cầu của quản lý.",https://www.topcv.vn/viec-lam/lap-trinh-frontend/1767391.html?ta_source=ITJobs_LinkDetail,Thoả thuận,CÔNG TY CỔ PHẦN CÔNG NGHỆ FOXAI,https://www.topcv.vn/cong-ty/cong-ty-co-phan-cong-nghe-foxai/156905.html,Cập nhật 3 ngày trước,Còn13ngày để ứng tuyển,"CSS, Git, HTML, 2+",Hà Nội
693022,Chuyên Viên Lập Trình Front End,N/A,15.0,30.0,3.0,3.0,Hà Nội,,"- Tham gia phát triển dự án lớn của công ty và đối tác trong các lĩnh vực tài chính ngân hàng.- Phát triển các ứng dụng trên nền tảng Javascript/ TypeScript(Angular)/ ...- Thực hiện các công việc trong quy trình phát triển phần mềm như thiết kế kịch bản phía máy khách và các khung JavaScript/TypeScript, bao gồm cả JQuery- Làm việc theo nhóm và mô hình Agile/Scrum- Nghiên cứu và sử dụng công nghệ mới.- Thực hiện các công việc khác do Trưởng dự án/Trưởng nhóm phân công.",https://www.topcv.vn/viec-lam/chuyen-vien-lap-trinh-front-end/693022.html?ta_source=ITJobs_LinkDetail,15 - 30 triệu,Công ty Cổ phần SIMBATECH,https://www.topcv.vn/cong-ty/cong-ty-co-phan-simbatech/32829.html,Cập nhật 3 ngày trước,Còn23ngày để ứng tuyển,"CSS, HTML, Javascript, 4+",Hà Nội
1919531,"MB Trainee - AI Engineer (Fresher, Intern) - Khối Công Nghệ Thông Tin (HOLT.14)",NGÂN HÀNG TMCP QUÂN ĐỘI – MBBANK,,,,,"Số 18 Lê Văn Lương, phường Trung Hòa, Cầu Giấy",2025-11-20,N/A,https://www.topcv.vn/brand/nganhangthuongmaicophanquandoi/tuyen-dung/mb-trainee-ai-engineer-fresher-intern-khoi-cong-nghe-thong-tin-holt-14-j1919531.html?ta_source=ITJobs_LinkDetail,Thoả thuận,NGÂN HÀNG TMCP QUÂN ĐỘI – MBBANK,https://www.topcv.vn/brand/nganhangthuongmaicophanquandoi?id=198860,Cập nhật 3 ngày trước,Còn13ngày để ứng tuyển,"Python, C/C++",Hà Nội
1917707,Android Developer (Java/Kotlin) - Tiếng Anh Tốt,N/A,35.0,50.0,3.0,3.0,Hà Nội,,"Develop and maintain Android applications for Backoffice and loan managementImplement payment terminal features and ensure data security complianceIntegrate mobile apps with backend APIs and servicesTroubleshoot, debug, and optimize mobile app performanceCollaborate with UI/UX designers to ensure high-quality user experiencesPerform testing, release management, and app store deploymentProvide ongoing support and updates for existing apps",https://www.topcv.vn/viec-lam/android-developer-java-kotlin-tieng-anh-tot/1917707.html?ta_source=ITJobs_LinkDetail,35 - 50 triệu,CÔNG TY CỔ PHẦN ALLIEX VIỆT NAM,https://www.topcv.vn/cong-ty/cong-ty-co-phan-alliex-viet-nam/67243.html,Cập nhật 3 ngày trước,Còn23ngày để ứng tuyển,"Java, Android SDK, Kotlin, 2+",Hà Nội
1874980,DEV - Embedded Software Engineer (C/C++),N/A,25.0,40.0,4.0,4.0,Hà Nội,,"- Design and develop new features for such network devices as GPON/EPGON ONT, Gateway Wi-Fi 802.11ac, ax and device drivers.- Design, develop and fix software errors of network protocols (Layer 2/Layer 3)- Develop gateway functionality based on Broadcom/RealTek/Cortina/Econet chipsets (Need the ability to develop various aspects without being restricted to specific functions)- Design and implement residence gateway features- Develop new network/ management features based on customers' requirement- Software development and debugging based on customer issues- Remote support for addressing international customer issues- Porting WiFi drivers to support WiFi chipset (Qualcomm, Broadcom...) based on products.- Verify and troubleshoot WiFi issues and tuning WiFi performance.- Customize WiFi features based on products and customer's requirement.- Develop additional WiFi features: easy mesh, bandsteering...",https://www.topcv.vn/viec-lam/dev-embedded-software-engineer-c-c/1874980.html?ta_source=ITJobs_LinkDetail,25 - 40 triệu,"VĂN PHÒNG ĐẠI DIỆN KAON GROUP CO., LTD TẠI THÀNH PHỐ HÀ NỘI",https://www.topcv.vn/cong-ty/van-phong-dai-dien-kaon-group-co-ltd-tai-thanh-pho-ha-noi/196631.html,Cập nhật 3 ngày trước,Còn10ngày để ứng tuyển,"Javascript, Shell script, TCP/IP, 4+",Hà Nội
1919498,"(Middle, Senior) FullStack Developer - Khối Công Nghệ Thông Tin (HOLT.12)",NGÂN HÀNG TMCP QUÂN ĐỘI – MBBANK,,,3.0,3.0,"Số 18 Lê Văn Lương, phường Trung Hòa, Cầu Giấy",2025-11-20,N/A,https://www.topcv.vn/brand/nganhangthuongmaicophanquandoi/tuyen-dung/middle-senior-fullstack-developer-khoi-cong-nghe-thong-tin-holt-12-j1919498.html?ta_source=ITJobs_LinkDetail,Thoả thuận,NGÂN HÀNG TMCP QUÂN ĐỘI – MBBANK,https://www.topcv.vn/brand/nganhangthuongmaicophanquandoi?id=198860,Cập nhật 3 ngày trước,Còn13ngày để ứng tuyển,"Java, Spring Framework, Lập Trình Backend, 8+",Hà Nội
1219856,Dynamics 365 CRM Developer,N/A,,,3.0,3.0,Hồ Chí Minh,,"Responsibilities:Responsible for the development, and on-going support of custom applications and objects within Microsoft Dynamics CRMServe as a Subject Matter Expert (SME) within all aspects of CRM software to include technical requirements, system configuration, user requirements, and system upgradesIdentify and implement third party applications to enhance and support the CRM systemPerform CRM application testing of configurations and customizations Lead and/or participate in analysis sessions with clients to determine application requirements for new CRM implementationsExtend capability of CRM through creation of new entities, forms, workflows, and reports",https://www.topcv.vn/viec-lam/dynamics-365-crm-developer/1219856.html?ta_source=ITJobs_LinkDetail,Thoả thuận,Công Ty SmartOSC,https://www.topcv.vn/cong-ty/cong-ty-smartosc/65.html,Cập nhật 3 ngày trước,Còn12ngày để ứng tuyển,,Hồ Chí Minh
1605787,Java Developer (Middle),SHINHAN FINANCE,,,3.0,3.0,Hồ Chí Minh,,"A member of Application Development team, who plays a supporting role in daily business requirements on IT system usage, develop and maintain in-house IT Java web applications and MIS reports.Develop and maintain in-house applicationsAnalyze business data/requirements to convert into effective report.Build MIS reports to support business requirementsComplete assigned tasks from line manager",https://www.topcv.vn/brand/shinhanfinance1/tuyen-dung/java-developer-middle-j1605787.html?ta_source=ITJobs_LinkDetail,Thoả thuận,SHINHAN FINANCE,https://www.topcv.vn/brand/shinhanfinance1?id=198515,Cập nhật 3 ngày trước,Còn38ngày để ứng tuyển,"J2EE, Java, Spring Framework, 1+",Hồ Chí Minh
1918131,Business Analyst,N/A,,36.0,4.0,4.0,Hà Nội,,"Responsibilities:Understand customer business process, needs and requirementsAnalyze the requirements from customers in business view and end-user viewEnsure business requirements are fully understood by Development and provide input to design and product specificationsDocument functional and business requirementCreate wireframes, activity diagrams and system process flowsTracking all change requests from customer. Manage all requirements, specifications, change request of the projectWork with development team to go over the specification, Q&A, consult the solutions or figure out the problemsOther tasks assigned",https://www.topcv.vn/viec-lam/business-analyst/1918131.html?ta_source=ITJobs_LinkDetail,Tới 36 triệu,CÔNG TY CỔ PHẦN SMARTOSC,https://www.topcv.vn/cong-ty/cong-ty-co-phan-smartosc/84788.html,Cập nhật 3 ngày trước,Còn12ngày để ứng tuyển,"Giao tiếp, Phân tích dữ liệu, Phân Tích Nghiệp Vụ, 2+",Hà Nội
1918017,Back-End Developer (Python),N/A,10.0,23.0,,1.0,Hà Nội,,"Maintain and enhance an existing CRM system, with a focus on backend components.Develop backend applications using Python.Design and implement APIs and messaging protocols to enable communication between system components.Work on development, testing, automation tools, and support the underlying IT infrastructure.",https://www.topcv.vn/viec-lam/back-end-developer-python/1918017.html?ta_source=ITJobs_LinkDetail,400 - 900 USD,CÔNG TY TNHH EAERA VIỆT NAM,https://www.topcv.vn/cong-ty/cong-ty-tnhh-eaera-viet-nam/194871.html,Cập nhật 3 ngày trước,Còn33ngày để ứng tuyển,"Python, Cơ Sở Dữ Liệu (sql, Nosql), Lập Trình Hướng Đối Tượng (oop), 6+",Hà Nội
