job_id,job_title,company,salary_min,salary_max,yrs_of_exp_min,yrs_of_exp_max,job_city,due_date,jd,job_url,salary_text,company_name,company_link,updated_at,time_left,tags,location
1713501,Lập Trình Viên Backend Java,N/A,16.0,32.0,3.0,3.0,Hà Nội,,"- Tham gia vào các công đoạn: kiến trúc hệ thống, thiết kế chức năng, lập trình, unit test, viết tài liệu chức năng, tối ưu performance...- Lập trình hệ thống các ứng dụng trên nền Java Core, Java Spring Boot và các hệ thống Middleware trên nền tảng java- Viết code và Unit test theo mô hình phát triển DevOps CI/CD- Tối ưu performance các xử lý giải thuật- Tham gia tìm hiểu các công nghệ, kỹ thuật mới.",https://www.topcv.vn/viec-lam/lap-trinh-vien-backend-java/1713501.html?ta_source=ITJobs_LinkDetail,16 - 32 triệu,Công ty Cổ phần SIMBATECH,https://www.topcv.vn/cong-ty/cong-ty-co-phan-simbatech/32829.html,Cập nhật 3 ngày trước,Còn23ngày để ứng tuyển,"Redis, kafka, RESTful APIs, 4+",Hà Nội
1919174,Nhân Viên Kỹ Thuật Máy In Tem Nhãn,N/A,7.0,7.0,,1.0,Hồ Chí Minh,,"Lắp đặt, cài đặt, HDSD các sản phẩm máy in barcode do công ty phân phối đến khách hàng. (được đào tạo)Bảo trì, sửa chữa, thay thế linh kiện theo yêu cầu của khách hàng.In tem, nhãn mã vạch theo yêu cầu của khách hàng & SalesQuản trị, hỗ trợ kỹ thuật cho khối văn phòng (thiết bị, công cụ làm việc).Các nhiệm vụ khác theo yêu cầu của trưởng bộ phậnSản phẩm chính của công ty: máy in mã vạch, nguyên vật liệu in (giấy in nhiệt, ruy băng mực, decal, tag, tem vải...)",https://www.topcv.vn/viec-lam/nhan-vien-ky-thuat-may-in-tem-nhan/1919174.html?ta_source=ITJobs_LinkDetail,7 - 9.5 triệu,CÔNG TY CỔ PHẦN THƯƠNG MẠI KỸ THUẬT MÃ VIỆT,https://www.topcv.vn/cong-ty/cong-ty-co-phan-thuong-mai-ky-thuat-ma-viet/3202.html,Cập nhật 3 ngày trước,Còn12ngày để ứng tuyển,"đọc hiểu tài liệu kỹ thuật, Kỹ Năng Chẩn Đoán Lỗi, Khả Năng Sửa Chữa Và Bảo Trì Máy In, 5+",Hồ Chí Minh
1919493,"(Middle, Senior) BackEnd Engineer (Java, Spring Boot) - Khối Công Nghệ Thông Tin (HOLT.11)",NGÂN HÀNG TMCP QUÂN ĐỘI – MBBANK,15.0,35.0,2.0,2.0,"18 Lê Văn Lương, Cầu Giấy",2025-11-20,N/A,https://www.topcv.vn/brand/nganhangthuongmaicophanquandoi/tuyen-dung/middle-senior-backend-engineer-java-spring-boot-khoi-cong-nghe-thong-tin-holt-11-j1919493.html?ta_source=ITJobs_LinkDetail,15 - 35 triệu,NGÂN HÀNG TMCP QUÂN ĐỘI – MBBANK,https://www.topcv.vn/brand/nganhangthuongmaicophanquandoi?id=198860,Cập nhật 3 ngày trước,Còn13ngày để ứng tuyển,,Hà Nội
1919278,Chuyên Viên Phân Tích Nghiệp Vụ (Business Analyst),N/A,18.0,24.0,2.0,2.0,Hà Nội,,"Thu thập, tìm hiểu yêu cầu nghiệp vụ từ khách hàng/nội bộ công ty để phân tích, đánh giá các Yêu cầu xây dựng hệ thống hoặc Yêu cầu thay đổi (CRs) trên hệ thống;Trao đổi, phối hợp với nhà cung cấp hệ thống hoặc nhóm phát triển sản phầm (Design/Dev/QC) để đưa ra giải pháp nghiệp vụ tối ưu, tối đa hóa giá trị sản phẩm cho người dùng và đảm bảo chất lượng sản phẩm;Chịu trách nhiệm truyền tải yêu cầu nghiệp vụ/giải pháp nghiệp vụ đúng đắn tới team phát triển;Chịu trách nhiệm xây dựng tài liệu yêu cầu (BRD), tài liệu đặc tả hệ thống (System Requirement Specification), danh sách các tính năng (Feature List), bố cục/giao diện sản phẩm (Wire frame/Mockup), luồng nghiệp vụ/tích hợp (Business Flow/Sequence Diagram);Hỗ trợ Quản lý dự án (PM) trong việc xác định phạm vi công việc của dự án, theo dõi backlog sản phẩm, nghiệm thu sản phẩm để đảm bảo kế hoạch và chất lượng sản phẩm;Phối hợp với các bộ phận liên quan để thực hiện rà soát hợp đồng cung cấp dịch vụ, xử lý nghiệm thu sản phẩm từ nhà cung cấp hệ thống;Phối hợp QC xây dựng tài liệu đào tạo, hướng dẫn người dùng sử dụng hệ thống;Hỗ trợ các bộ phận PR/Marketing hoặc trực tiếp demo giới thiệu sản phẩm cho khách hàng.",https://www.topcv.vn/viec-lam/chuyen-vien-phan-tich-nghiep-vu-business-analyst/1919278.html?ta_source=ITJobs_LinkDetail,18 - 24 triệu,CÔNG TY CỔ PHẦN ĐẦU TƯ CHÂU Á - THÁI BÌNH DƯƠNG,https://www.topcv.vn/cong-ty/cong-ty-co-phan-dau-tu-chau-a-thai-binh-duong/200853.html,Cập nhật 3 ngày trước,Còn12ngày để ứng tuyển,"Phân Tích Nghiệp Vụ, Thu Thập Yêu Cầu, Mô Hình Hóa Quy Trình, 2+",Hà Nội
1919474,"FullStack Developer (Junior, Senior) - Khối Công Nghệ Thông Tin (HOLT.04)",NGÂN HÀNG TMCP QUÂN ĐỘI – MBBANK,,,1.0,1.0,"Số 18 Lê Văn Lương, phường Trung Hòa, Cầu Giấy",2025-11-20,N/A,https://www.topcv.vn/brand/nganhangthuongmaicophanquandoi/tuyen-dung/fullstack-developer-junior-senior-khoi-cong-nghe-thong-tin-holt-04-j1919474.html?ta_source=ITJobs_LinkDetail,Thoả thuận,NGÂN HÀNG TMCP QUÂN ĐỘI – MBBANK,https://www.topcv.vn/brand/nganhangthuongmaicophanquandoi?id=198860,Cập nhật 3 ngày trước,Còn13ngày để ứng tuyển,"Java, Spring Framework, Backend, 5+",Hà Nội
1919234,Business Analyst (BA) - Up To 40 Triệu - Tại Hà Nội,N/A,,,2.0,2.0,Hà Nội,,"1. Mô tả công việc• Làm việc với PO, PMO và khách hàng, nhận yêu cầu, đánh giá và tư vấn các giải pháp, quy trình của phần mềm • Phân tích tính khả thi và làm chi tiết các yêu cầu, từ đó xây dựng các tài liệu kĩ thuật, tài liệu nghiệp vụ, đảm bảo tính chính xác và phù hợp với yêu cầu • Phân tích và thiết kế các tài liệu BRD, Use case, flowchart, wireframe/mockup, ... • Đảm bảo chất lượng tài liệu nghiệp vụ hệ thống, phân tích và hỗ trợ các thành viên khác để đảm bảo đội ngũ hiểu rõ yêu cầu của sản phẩm • Quản lý và cập nhật các luồng nghiệp vụ khi có thay đổi hoặc phát sinh • Đảm nhận và đánh giá chất lượng sản phẩm trước khi release • Phối hợp với đội ngũ để nâng cao chất lượng sản phẩm và quy trình phát triển sản phẩm.",https://www.topcv.vn/viec-lam/business-analyst-ba-up-to-40-trieu-tai-ha-noi/1919234.html?ta_source=ITJobs_LinkDetail,Thoả thuận,CÔNG TY CỔ PHẦN GIẢI PHÁP SỐ MOBIFONE,https://www.topcv.vn/cong-ty/cong-ty-co-phan-giai-phap-so-mobifone/231268.html,Cập nhật 3 ngày trước,Còn16ngày để ứng tuyển,,Hà Nội
1920072,Fullstack Developer,N/A,20.0,30.0,2.0,2.0,Hà Nội,,"• Tham gia phân tích, thiết kế, phát triển ứng dụng web và API phục vụ nghiệp vụ dịch 
vụ/thương mại (bán hàng, kho, đơn hàng, thanh toán, chăm sóc khách hàng). 
• Xây dựng, tích hợp hoặc mở rộng các module ERP/CRM (Sales, Inventory, Accounting, Support, Loyalty...).• Tối ưu hiệu năng, bảo mật; viết unit/integration test; review code; tham gia CI/CD. 
• Phối hợp BA/PO/Designer để làm rõ yêu cầu, đưa giải pháp kỹ thuật, ước lượng và triển khai theo sprint.• Tích hợp dịch vụ bên thứ ba (cổng thanh toán, SMS/Email, vận chuyển, eKYC...).• Viết tài liệu kỹ thuật, hướng dẫn bàn giao cho vận hành. 
• Hỗ trợ vận hành/sửa lỗi sau triển khai (theo vòng đời sản phẩm",https://www.topcv.vn/viec-lam/fullstack-developer/1920072.html?ta_source=ITJobs_LinkDetail,20 - 30 triệu,Công Ty TNHH Thương Mại FC Việt Nam,https://www.topcv.vn/cong-ty/cong-ty-tnhh-thuong-mai-fc-viet-nam/119553.html,Cập nhật 3 ngày trước,Còn13ngày để ứng tuyển,,Hà Nội
1920086,Thực Tập Sinh Backend Java,N/A,,2.0,,,Hà Nội,,"Tham gia khóa đào tạo dành cho nhân viên mớiĐược tham gia vào các dự án thực tế để học hỏi kinh nghiệmTham gia vào các dự án của công ty sau khóa đào tạoTham gia vào dự án phát triển với khách hàng trong và ngoài nướcXây dựng các giải pháp, viết các phần mềm theo yêu cầu của công tyTrao đổi cụ thể khi phỏng vấn",https://www.topcv.vn/viec-lam/thuc-tap-sinh-backend-java/1920086.html?ta_source=ITJobs_LinkDetail,Tới 2 triệu,Công ty cổ phần Công nghệ VISSOFT,https://www.topcv.vn/cong-ty/cong-ty-co-phan-cong-nghe-vissoft/18747.html,Cập nhật 3 ngày trước,Còn23ngày để ứng tuyển,"Java, Cấu Trúc Dữ Liệu Và Giải Thuật, Lập Trình Hướng Đối Tượng (oop), 2+",Hà Nội
